{
  "schemaVersion": "1.0.0",
  "packId": "manufacturing",
  "name": "The Resilient Production Site",
  "industry": "Manufacturing & industrial facilities",
  "subtitle": "From connected plant to OEE, energy per unit, safety and production resilience",
  "customer": {
    "name": "Synthetic reference enterprise",
    "sector": "Manufacturing & industrial facilities",
    "scope": "Illustrative account with synthetic operational and economic data"
  },
  "status": "synthetic",
  "provenance": {
    "method": "illustrative-workshop",
    "created": "2026-10-09",
    "disclaimer": "All signals and financial numbers are synthetic, not customer telemetry or guaranteed value."
  },
  "theme": {
    "accent": "#16a78a",
    "visualKey": "manufacturing"
  },
  "navigation": [
    {
      "id": "story",
      "label": "Guided Story",
      "icon": "play"
    },
    {
      "id": "signals",
      "label": "Signal Reasoning",
      "icon": "activity"
    },
    {
      "id": "explore",
      "label": "Value Explorer",
      "icon": "spark"
    },
    {
      "id": "graph",
      "label": "Value Graph",
      "icon": "network"
    },
    {
      "id": "evidence",
      "label": "Evidence & Risk",
      "icon": "shield"
    },
    {
      "id": "economics",
      "label": "Economics",
      "icon": "chart"
    },
    {
      "id": "new",
      "label": "New Customer",
      "icon": "users"
    },
    {
      "id": "lab",
      "label": "Pack Studio",
      "icon": "database"
    }
  ],
  "lenses": {
    "customer": {
      "label": "Customer",
      "icon": "building",
      "description": "The customer buys a measurable change to enterprise performance — not a collection of systems."
    },
    "partner": {
      "label": "Partner",
      "icon": "handshake",
      "description": "The partner monetises discovery, integration, managed operations and value assurance."
    },
    "cisco": {
      "label": "Cisco + ecosystem",
      "icon": "network",
      "description": "Capabilities are selected only after a value hypothesis and delivery dependencies are understood."
    }
  },
  "nodes": [
    {
      "id": "b1",
      "type": "board",
      "title": "Increase reliable throughput",
      "summary": "Lift constrained production capacity without unnecessary capital",
      "icon": "target",
      "evidenceStatus": "illustrative",
      "confidence": "to-validate"
    },
    {
      "id": "b2",
      "type": "board",
      "title": "Reduce cost per good unit",
      "summary": "Reduce downtime and energy intensity",
      "icon": "target",
      "evidenceStatus": "illustrative",
      "confidence": "to-validate"
    },
    {
      "id": "b3",
      "type": "board",
      "title": "Protect safe, resilient operations",
      "summary": "Improve safety, cyber resilience and traceability",
      "icon": "target",
      "evidenceStatus": "illustrative",
      "confidence": "to-validate"
    },
    {
      "id": "f1",
      "type": "function",
      "title": "Plant director",
      "summary": "Accountable decision maker in this value stream.",
      "icon": "users",
      "evidenceStatus": "illustrative",
      "confidence": "to-validate"
    },
    {
      "id": "f2",
      "type": "function",
      "title": "Production / Quality",
      "summary": "Accountable decision maker in this value stream.",
      "icon": "users",
      "evidenceStatus": "illustrative",
      "confidence": "to-validate"
    },
    {
      "id": "f3",
      "type": "function",
      "title": "Maintenance",
      "summary": "Accountable decision maker in this value stream.",
      "icon": "users",
      "evidenceStatus": "illustrative",
      "confidence": "to-validate"
    },
    {
      "id": "f4",
      "type": "function",
      "title": "EHS / Sustainability",
      "summary": "Accountable decision maker in this value stream.",
      "icon": "users",
      "evidenceStatus": "illustrative",
      "confidence": "to-validate"
    },
    {
      "id": "f5",
      "type": "function",
      "title": "OT / IT / Finance",
      "summary": "Accountable decision maker in this value stream.",
      "icon": "users",
      "evidenceStatus": "illustrative",
      "confidence": "to-validate"
    },
    {
      "id": "s1",
      "type": "signal",
      "title": "Repeated micro-stops",
      "summary": "Historian and shift records suggest recurring losses at a constrained workstation.",
      "icon": "activity",
      "evidenceStatus": "hypothesis",
      "confidence": "to-validate",
      "layer": "asset",
      "sourceId": "d1",
      "sceneXY": [
        31,
        38
      ]
    },
    {
      "id": "d1",
      "type": "source",
      "title": "OT historian / MES / PLC events",
      "summary": "Potential source of evidence; availability must be confirmed.",
      "icon": "database",
      "evidenceStatus": "unverified",
      "confidence": "to-validate",
      "dataClassification": "operational / restricted"
    },
    {
      "id": "s2",
      "type": "signal",
      "title": "Energy per good unit",
      "summary": "Energy peaks may not align with productive machine time.",
      "icon": "activity",
      "evidenceStatus": "hypothesis",
      "confidence": "to-validate",
      "layer": "energy",
      "sourceId": "d2",
      "sceneXY": [
        63,
        28
      ]
    },
    {
      "id": "d2",
      "type": "source",
      "title": "Meters / production counts / tariffs",
      "summary": "Potential source of evidence; availability must be confirmed.",
      "icon": "database",
      "evidenceStatus": "unverified",
      "confidence": "to-validate",
      "dataClassification": "operational / restricted"
    },
    {
      "id": "s3",
      "type": "signal",
      "title": "Condition alerts vs backlog",
      "summary": "Maintenance flags coincide with repeat work orders and spares delays.",
      "icon": "activity",
      "evidenceStatus": "hypothesis",
      "confidence": "to-validate",
      "layer": "signal",
      "sourceId": "d3",
      "sceneXY": [
        56,
        61
      ]
    },
    {
      "id": "d3",
      "type": "source",
      "title": "CMMS / vibration sensors / work orders",
      "summary": "Potential source of evidence; availability must be confirmed.",
      "icon": "database",
      "evidenceStatus": "unverified",
      "confidence": "to-validate",
      "dataClassification": "operational / restricted"
    },
    {
      "id": "h1",
      "type": "hypothesis",
      "title": "Constraint uptime recovery",
      "summary": "Run a measured maintenance and scheduling intervention against baseline OEE loss.",
      "icon": "spark",
      "evidenceStatus": "hypothesis",
      "confidence": "to-validate",
      "metricId": "k1",
      "financialModel": {
        "annualPoolGBP": 42000000,
        "opportunityPct": 3.2,
        "captureFactor": 0.65,
        "implementationGBP": 520000,
        "serviceAnnualGBP": 140000,
        "currency": "GBP"
      }
    },
    {
      "id": "k1",
      "type": "metric",
      "title": "OEE, availability, good units",
      "summary": "Outcome metric requiring baseline, owner and method.",
      "icon": "chart",
      "evidenceStatus": "illustrative",
      "confidence": "to-validate"
    },
    {
      "id": "h2",
      "type": "hypothesis",
      "title": "Energy intensity improvement",
      "summary": "Test equipment scheduling and idle-state management subject to production constraints.",
      "icon": "spark",
      "evidenceStatus": "hypothesis",
      "confidence": "to-validate",
      "metricId": "k2",
      "financialModel": {
        "annualPoolGBP": 8000000,
        "opportunityPct": 7,
        "captureFactor": 0.65,
        "implementationGBP": 380000,
        "serviceAnnualGBP": 100000,
        "currency": "GBP"
      }
    },
    {
      "id": "k2",
      "type": "metric",
      "title": "kWh / good unit",
      "summary": "Outcome metric requiring baseline, owner and method.",
      "icon": "chart",
      "evidenceStatus": "illustrative",
      "confidence": "to-validate"
    },
    {
      "id": "h3",
      "type": "hypothesis",
      "title": "Predictive maintenance workflow",
      "summary": "Test condition-based interventions while separating genuine early warnings from noise.",
      "icon": "spark",
      "evidenceStatus": "hypothesis",
      "confidence": "to-validate",
      "metricId": "k3",
      "financialModel": {
        "annualPoolGBP": 9000000,
        "opportunityPct": 7.5,
        "captureFactor": 0.65,
        "implementationGBP": 330000,
        "serviceAnnualGBP": 125000,
        "currency": "GBP"
      }
    },
    {
      "id": "k3",
      "type": "metric",
      "title": "MTBF, MTTR, scrap",
      "summary": "Outcome metric requiring baseline, owner and method.",
      "icon": "chart",
      "evidenceStatus": "illustrative",
      "confidence": "to-validate"
    },
    {
      "id": "c1",
      "type": "capability",
      "title": "Cisco industrial networking",
      "summary": "Resilient plant connectivity and segmentation",
      "icon": "network",
      "evidenceStatus": "illustrative",
      "confidence": "to-validate"
    },
    {
      "id": "c2",
      "type": "capability",
      "title": "Cisco security for IT/OT",
      "summary": "Visibility, policy and protected remote access",
      "icon": "network",
      "evidenceStatus": "illustrative",
      "confidence": "to-validate"
    },
    {
      "id": "c3",
      "type": "capability",
      "title": "Splunk / observability",
      "summary": "Correlated events from authorised operational sources",
      "icon": "network",
      "evidenceStatus": "illustrative",
      "confidence": "to-validate"
    },
    {
      "id": "p1",
      "type": "partner",
      "title": "Industrial engineering / OT SI",
      "summary": "Safety-aligned integration with MES, historian and PLC estates",
      "icon": "handshake",
      "evidenceStatus": "illustrative",
      "confidence": "to-validate"
    },
    {